reference,description_courte,description_longue
MH32314,"Ce brassière, fait d'un microfibre haut de gamme, se pare d'une douceur exceptionnelle et d'un design élégant. Idéal pour agrandir légèrement les formes tout en offrant un confort optimal.","Ce modèle est une pièce essentielle à ajouter dans votre dressing, grâce à sa doublure en microfibre de haute qualité qui procure un toucher soyeux et une sensation de légèreté incomparable. Les coutures et les formes des coupes sont soignées pour offrir une silhouette harmonieuse même aux plus petites nichons. Ce brassière offre deux lanières ajustables, permettant une personnalisation parfaite : un côté avec des épaulettes siliconées pour la discrétion, et le traditionnel pour une allure classique. Les inserts amovibles et magnifiques complètent cet ensemble, ajoutant une touche supplémentaire de distinction."
MH32319,"Un jupon en soie légère et élégant, doté d'un liseré de dentelle subtile qui met en valeur votre peau. Sa coupure audacieuse et son ruban charmant vous invitent à des découvertes passionnées.","Ce sous-vêtement en coton et élasthanne, doté d'un graphisme en dentelles légers, joue habilement les contrastes pour mettre en valeur votre beauté. La découpe audacieuse de ce jupon souligne votre féminité avec élégance, tandis que le ruban gracieux ajoute une touche coquine et raffinée. À porter seule ou associée à un soutien-gorge érotique comme le Blackjack, cette lingerie offre un moment de flirt unique et inattendu."
MH32326,"Un string court élégant en nylon 100 %, orné de dentelle fine à motifs floraux et agrémenté d'un joli ruban satiné pour un charme irrésistible.","Ce string court joue avec la sensualité la plus délicate, offrant une silhouette élégante grâce à son tissu en nylon 100 % de qualité supérieure. Décoré d'une dentelle fine à motifs floraux qui souligne le goût raffiné du porteur, ce modèle sublime est encore plus séduisant avec un joli ruban satiné sur le devant. Ce détail ajouté fait d'ici un accessoire indispensable pour ajouter une touche de grâce et de mystère à vos tenues intimes."
MH32336,"Une pièce noire élégante et glamour, le corset Carmen allonge votre silhouette tout en mettant en valeur vos courbes.","<p>Le corset Carmen est une parure de soirée luxueuse qui sublime votre silhouette en mettant en évidence vos courbes les plus harmonieuses. Sa lingerie noire s'adapte parfaitement à votre forme grâce à la finition en corset et au fermoir-œillet, tout en scintillant de strass Swarovski qui soulignent l'ouvrage délicat en dentelle noire brillant d'un éclat argenté. Une pièce irrésistiblement séduisante, elle promet des sensations inoubliables à vos mains.</p>"
MH32338,"Un jupon V-3008 au design audacieux et sensuel, agrémenté d'un élastique double velouté noir qui met en valeur la rondeur des hanches. La dentelle lisse et élégante offre une décoration féminine subtile, renforcée par de gracieux rubans satinés. Un m","Le jupon V-3008 joue sur les contrastes avec un élastique double en velours noir, soulignant parfaitement la rondeur des hanches. La dentelle lisse et élégante est ornée de motifs délicats, offrant une touche féminine raffinée. Les rubans satinés ajoutent une note ludique et charmante à cette pièce unique, idéale pour une femme qui cherche à se distinguer par son style et sa personnalité. Ce modèle noir totalise 73% de polyester et 22% de nylon, assurant confort et élégance avec chaque mouvement."
MH32373,"Ce soutien-gorge en tulle et dentelle écru met en valeur votre silhouette avec des détails sublimes, offrant une forme avantageuse et élégante au sein. Sa douceur et son ajustement personnalisé le rendent unique.","Le soutien-gorge V-4281 est un chef-d'œuvre de lingerie intime, conçu pour mettre en valeur vos plus beaux atouts avec une élégance discrète. Sa doublure en tulle beige et son joli décolleté orné de dentelle écru et noire crée un effet captivant qui accentue la silhouette féminine. Les bretelles ajustables permettent d'adapter ce modèle aux différentes tenues, offrant une sensation de bien-être et de sensualité inégalée. Ce bijou intime est idéal pour celles qui recherchent une lingerie qui reflète leur individualité et renforce leur féminité."
MH32375,"Un jupon taille haute en tissu soyeux et dentelle légère, dans un doux beige qui révèle la féminité avec élégance.","<p>Le modèle V-4288 est une œuvre de raffinement et de séduction, conçue pour éveiller les sens. En beige subtil, ce jupon taille haute associe le coton fin et la dentelle discrète du polyamide, offrant un confort sans pareil tout en soulignant la féminité avec élégance.</p><p>La douceur des matières et l'art subtil de la dentelle créent une illusion de légèreté, où chaque détail est soigneusement choisi pour que vous ressentiez pleinement le charme intime de cette pièce.</p>"
MH33104,"Ce soutien-gorge en beige, doté de bretelles en silicone ajustables au dos, est idéal pour des tenues ajustées. Sa microfibre douce et son insert magnétique amovible assurent une élégance parfaite.","<p>Le soutien-gorge en beige propose des bretelles en silicone qui se ferment discrètement au dos, parfaitement adaptées aux tenues ajustées avec des décolletés élégants. Confectionné en microfibre douce et sobre, ce modèle combine une élégance raffinée avec un confort optimal. Grâce à l'insert magnétique amovible et aux bretelles ajustables, vous pouvez trouver la tenue qui correspond le mieux à vos envies.</p>"
MH33107,"Soutien-gorge en noir épuré, doté de bretelles en silicone ajustables et d'un dos transparent, idéal sous des vêtements ajustés avec un dos dévoilé.","Ce soutien-gorge élégant en noir propose une silhouette fluide et une douceur sans pareille. Grâce à ses bretelles en silicone ajustables et son dos transparent, il s'adapte parfaitement aux tenues ajustées avec un dos dévoilé. Sa fermeture avant et les inserts magnifiques amovibles renforcent son confort et sa raffinement. En composants de qualité – coton, élasthanne, polyamide et polyuréthane – il offre à la fois une silhouette parfaite et un maximum de confort."
MH33111,"Soutien-gorge en coton et élasthanne, coloris beige délicat, agrémenté de brides siliconées et inserts magnifiques ajustables.","<p>Sous-vêtement élégant en beige subtil, doté d'un dos transparent pour se marier harmonieusement avec des tenues ajustées à décolleté nu. Ce soutien-gorge est doux et confortable grâce à sa composition de coton et élasthanne, tout en offrant un maintien optimal. Les brides siliconées sont réglables et les inserts magnifiques peuvent être retirés pour une personnalisation unique.</p>"
MH33114,"Soutien-gorge en dentelle blanche avec dos transparent et sangles réglables en silicone, parfait pour des tenues ajustées révélant la nuque.","Ce soutien-gorge élégant en blanc se distingue par sa douceur de tissu et son confort inégalé. Grâce à ses sangles en silicone ajustables et ses disques magnifiques amovibles, il s'adapte parfaitement aux formes pour un look impeccable sous des tenues ajustées avec une nuque exposée. Sa douceur de coton et la légèreté du spandex assurent à la fois support et voluptueux confort."
MH33136,"Subtiles sous vos vêtements, ces string en microfibres beige assurent un parfait confort et une élégance inaltérable au quotidien et lors des grandes occasions.","Créant une seconde peau fluide et discrète, ces strings en microfibres beige offrent une parfaite association entre élégance et confort. Enveloppant la silhouette avec légèreté, ils sont idéaux pour habiller un tailleur strict ou un ensemble de soirée. La finesse du tissu, composé à 78 % de viscose pour un toucher doux et naturel, à 3 % de coton offrant une touche de respirabilité, et 19 % d'élasthanne pour la souplesse, permettent de bénéficier d'une journée sans contraintes. Ils sont invisibles sous vos vêtements et révèlent un look élégant partout où que vous alliez."
MH33137,"Un jupon en microfibres noir, doux et imperceptible sous vos vêtements, offre une parfaite allure et un maximum de confort.","Cette lingerie intime subtile est réalisée en microfibres noirs, offrant la légèreté du coton et l'élasticité indispensable pour un ajustement parfaît. Invisibles sous vos vêtements, ces sous-vêtements élégants assurent à la fois un look irréprochable et un confort maximal, qu'il s'agisse d'un outfit casual ou d'une tenue de soirée."
MH33149,"Soutien-gorge en microfibres doux et érotique, avec un devant en dentelle noire et des rubans rose poudré, pour un effet sensuel harmonieux.","<p>Le soutien-gorge Pansy V-5091 est conçu dans une douce microfibre de couleur noir élégante, agrémentée d'une fine dentelle noire qui se teinte d'un rose poudré subtile. Les côtés sont renforcés par un sous-vide vertical en acier inoxydable, et de jolis rubans roses ornent les bretelles et la ceinture entre les cups. Ces détails floraux et l’ajustabilité des bretelles révèlent une lingerie raffinée tout à la fois discrète et élégante.</p>"
MH33155,Ce soutien-gorge en tulle noir et dentelle argentée vous transporte vers un univers sensuel et unique. Idéal pour une allure dévêtue.,"Le modèle V-5391 Praise Me joue avec l'illusion de transparence grâce à son double tulle et sa fine dentelle argentée, offrant une silhouette raffinée tout en laissant entrevoir des courbes charmantes. Le fini noir et le détail brodé en argent ajoutent un soupçon de mystère et de sophistication à cette pièce intime parfaite pour illuminer votre regard avec élégance."
MH33157,"Lingerie raffinée en étoffe de qualité suprême, teinte écarlate audacieuse et douceur infinie pour un port subtil et sensuel.","Cette lingerie se distingue par la simplicité élégante de ses sous-vêtements ainsi que l'abondance des insertions en dentelle. Le coloris rouge passion éclairez la peau, ajoutant une touche audacieuse tout en retenue. Elle est réalisée avec soin à partir de coton, d'élasthanne et de polyamide pour garantir un port incomparablement confortable. Les bretelles ajustables et le ruban au décolleté offrent flexibilité et élégance, tout en laissant place à une sensualité discrète mais intense."
MH33158,"Une douceur rose sertie de tulle rose adoucit les bords des tissus, offrant une élégance audacieuse et discrète. Une parfaite union entre raffinement et sensualité.","<p>La sophistication du soutien-gorge Madamme s'exprime dans un nuancier de rose pâle, où la finesse d'un ruban en tulle rosé adoucit les contours des bords. Ce modèle audacieux et classiquement élégant est unique comme vous l’êtes. Sentez-vous séduite par la caresse douce et luxueuse de ses matières précieuses et les détails raffinés de ses accessoires. Dans ce modèle, votre silhouette sera mise en valeur avec subtilité et sensuelle grâce à des bretelles ajustables et détachables, offrant ainsi un confort personnalisé.</p>"
MH33159,"Un jupon en coton et élasthanne, couleur rose tendre, subtilément coupé pour ravir les sens.","<p>Confectionné à partir de coton et d'élasthanne pour une douceur incomparable, ce jupon rose met en valeur la féminité tout en offrant une parfaite liberté de mouvement. Sa coupe élégante et subtile séduit par son élégance discrète et son confort maximal.</p><p>Le choix d’un coloris rose tendre apporte douceur et modernité à toute tenue, rendant l’instant présent inoubliable tout en respectant la plus stricte exigence de bien-être.</p>"
MH33186,"Sous-poissonnets en pêche et rose, ourleté de dentelle avec des rubans satinés, offrant un soutien voluptueux tout en subtilité.","Cette pièce maîtresse revisite le style Lolita avec raffinement. La douceur de la dentelle en deux tons de rose s'accorde parfaitement à une finesse de pêche et satin, créant un ensemble harmonieux. Le porte-seins push-up sublime la poitrine tout en la rendant encore plus attirante, tandis que les rubans ajustables et les inserts amovibles permettent d'adapter l'ensemble à chaque silhouette avec élégance. La finesse du tissu, mélange de coton, élasthanne et polyester, est un délice pour les sens, offrant confort et élégance dans le même souffle."
MH33237,"Sous-vêtement intemporel en coton et élasthanne, agrémenté de paillettes argentées pour un effet sobrement élégant, idéal pour des tenues décolletées.","Le soutien-gorge V-5311 « Hide Me » offre une silhouette intrigante avec son design semi-corset, accentuant votre éclat. Enveloppant et élégant, ce modèle se démarque par ses bretelles ajustables et ses padets qui soulignent parfaitement le décolleté. Un léger détail de fil argenté subtilement brodé apporte à cet ensemble un air chic et raffiné. Disponible en noir, cette pièce est confectionnée avec 24% de coton, 4% d'élasthanne, 45% de polyuréthane et 10% de polyester, garantissant confort et élégance dans la plus pure tradition de notre maison."
